"No.","Time","Source","Destination","Protocol","Length","Info"
"6","0.006372","176.235.75.83","172.16.7.65","TCP","56","443  >  54052 [ACK] Seq=1 Ack=1957 Win=506 Len=0"
"7","0.006372","176.235.75.83","172.16.7.65","TCP","56","443  >  54052 [ACK] Seq=1 Ack=3867 Win=521 Len=0"
"8","0.009957","176.235.75.83","172.16.7.65","TLSv1.2","1436","Application Data, Application Data, Application Data, Application Data, Application Data, Application Data, Application Data, Application Data, Application Data, Application Data, Application Data, Application Data, Application Data, Application Data"
"9","0.009957","176.235.75.83","172.16.7.65","TLSv1.2","133","Application Data, Application Data"
"10","0.009957","176.235.75.83","172.16.7.65","TLSv1.2","1436","Application Data, Application Data, Application Data, Application Data, Application Data"
"11","0.009957","176.235.75.83","172.16.7.65","TCP","1436","443  >  54052 [ACK] Seq=2844 Ack=3867 Win=521 Len=1382 [TCP segment of a reassembled PDU]"
"12","0.009957","176.235.75.83","172.16.7.65","TCP","1436","443  >  54052 [ACK] Seq=4226 Ack=3867 Win=521 Len=1382 [TCP segment of a reassembled PDU]"
"13","0.009957","176.235.75.83","172.16.7.65","TCP","1436","443  >  54052 [ACK] Seq=5608 Ack=3867 Win=521 Len=1382 [TCP segment of a reassembled PDU]"
"14","0.009957","176.235.75.83","172.16.7.65","TCP","1436","443  >  54052 [ACK] Seq=6990 Ack=3867 Win=521 Len=1382 [TCP segment of a reassembled PDU]"
"15","0.009957","176.235.75.83","172.16.7.65","TCP","1436","443  >  54052 [ACK] Seq=8372 Ack=3867 Win=521 Len=1382 [TCP segment of a reassembled PDU]"
"16","0.009957","176.235.75.83","172.16.7.65","TCP","1436","443  >  54052 [ACK] Seq=9754 Ack=3867 Win=521 Len=1382 [TCP segment of a reassembled PDU]"
"17","0.009957","176.235.75.83","172.16.7.65","TCP","1436","443  >  54052 [ACK] Seq=11136 Ack=3867 Win=521 Len=1382 [TCP segment of a reassembled PDU]"
"18","0.009957","176.235.75.83","172.16.7.65","TCP","1436","443  >  54052 [ACK] Seq=12518 Ack=3867 Win=521 Len=1382 [TCP segment of a reassembled PDU]"
"19","0.009957","176.235.75.83","172.16.7.65","TCP","1436","443  >  54052 [ACK] Seq=13900 Ack=3867 Win=521 Len=1382 [TCP segment of a reassembled PDU]"
"21","0.010396","176.235.75.83","172.16.7.65","TCP","1436","443  >  54052 [ACK] Seq=15282 Ack=3867 Win=521 Len=1382 [TCP segment of a reassembled PDU]"
"22","0.010396","176.235.75.83","172.16.7.65","TCP","1436","443  >  54052 [ACK] Seq=16664 Ack=3867 Win=521 Len=1382 [TCP segment of a reassembled PDU]"
"23","0.010396","176.235.75.83","172.16.7.65","TLSv1.2","1436","Application Data"
"24","0.010396","176.235.75.83","172.16.7.65","TCP","1436","443  >  54052 [ACK] Seq=19428 Ack=3867 Win=521 Len=1382 [TCP segment of a reassembled PDU]"
"25","0.010396","176.235.75.83","172.16.7.65","TCP","1436","443  >  54052 [ACK] Seq=20810 Ack=3867 Win=521 Len=1382 [TCP segment of a reassembled PDU]"
"26","0.010396","176.235.75.83","172.16.7.65","TCP","1436","443  >  54052 [ACK] Seq=22192 Ack=3867 Win=521 Len=1382 [TCP segment of a reassembled PDU]"
"28","0.011221","176.235.75.83","172.16.7.65","TCP","1436","443  >  54052 [ACK] Seq=23574 Ack=3867 Win=521 Len=1382 [TCP segment of a reassembled PDU]"
"29","0.011221","176.235.75.83","172.16.7.65","TCP","1436","443  >  54052 [PSH, ACK] Seq=24956 Ack=3867 Win=521 Len=1382 [TCP segment of a reassembled PDU]"
"30","0.011221","176.235.75.83","172.16.7.65","TCP","1436","443  >  54052 [ACK] Seq=26338 Ack=3867 Win=521 Len=1382 [TCP segment of a reassembled PDU]"
"31","0.011221","176.235.75.83","172.16.7.65","TCP","1436","443  >  54052 [ACK] Seq=27720 Ack=3867 Win=521 Len=1382 [TCP segment of a reassembled PDU]"
"32","0.011221","176.235.75.83","172.16.7.65","TCP","1436","443  >  54052 [ACK] Seq=29102 Ack=3867 Win=521 Len=1382 [TCP segment of a reassembled PDU]"
"33","0.011221","176.235.75.83","172.16.7.65","TCP","1436","443  >  54052 [ACK] Seq=30484 Ack=3867 Win=521 Len=1382 [TCP segment of a reassembled PDU]"
"34","0.011221","176.235.75.83","172.16.7.65","TCP","1436","443  >  54052 [ACK] Seq=31866 Ack=3867 Win=521 Len=1382 [TCP segment of a reassembled PDU]"
"35","0.011221","176.235.75.83","172.16.7.65","TLSv1.2","1436","Application Data"
"36","0.011221","176.235.75.83","172.16.7.65","TCP","1436","443  >  54052 [ACK] Seq=34630 Ack=3867 Win=521 Len=1382 [TCP segment of a reassembled PDU]"
"37","0.011221","176.235.75.83","172.16.7.65","TCP","1436","443  >  54052 [ACK] Seq=36012 Ack=3867 Win=521 Len=1382 [TCP segment of a reassembled PDU]"
"38","0.011221","176.235.75.83","172.16.7.65","TCP","1436","443  >  54052 [ACK] Seq=37394 Ack=3867 Win=521 Len=1382 [TCP segment of a reassembled PDU]"
"39","0.011221","176.235.75.83","172.16.7.65","TCP","1436","443  >  54052 [ACK] Seq=38776 Ack=3867 Win=521 Len=1382 [TCP segment of a reassembled PDU]"
"40","0.011221","176.235.75.83","172.16.7.65","TCP","1436","443  >  54052 [ACK] Seq=40158 Ack=3867 Win=521 Len=1382 [TCP segment of a reassembled PDU]"
"41","0.011221","176.235.75.83","172.16.7.65","TCP","1436","443  >  54052 [ACK] Seq=41540 Ack=3867 Win=521 Len=1382 [TCP segment of a reassembled PDU]"
"42","0.011221","176.235.75.83","172.16.7.65","TCP","1436","443  >  54052 [ACK] Seq=42922 Ack=3867 Win=521 Len=1382 [TCP segment of a reassembled PDU]"
"43","0.011221","176.235.75.83","172.16.7.65","TCP","1436","443  >  54052 [ACK] Seq=44304 Ack=3867 Win=521 Len=1382 [TCP segment of a reassembled PDU]"
"45","0.011571","176.235.75.83","172.16.7.65","TCP","1436","443  >  54052 [ACK] Seq=45686 Ack=3867 Win=521 Len=1382 [TCP segment of a reassembled PDU]"
"46","0.011571","176.235.75.83","172.16.7.65","TCP","1436","443  >  54052 [ACK] Seq=47068 Ack=3867 Win=521 Len=1382 [TCP segment of a reassembled PDU]"
"47","0.011571","176.235.75.83","172.16.7.65","TCP","1436","443  >  54052 [ACK] Seq=48450 Ack=3867 Win=521 Len=1382 [TCP segment of a reassembled PDU]"
"49","0.012813","176.235.75.83","172.16.7.65","TLSv1.2","1436","Application Data"
"50","0.012813","176.235.75.83","172.16.7.65","TCP","1436","443  >  54052 [ACK] Seq=51214 Ack=3867 Win=521 Len=1382 [TCP segment of a reassembled PDU]"
"51","0.012813","176.235.75.83","172.16.7.65","TCP","1436","443  >  54052 [ACK] Seq=52596 Ack=3867 Win=521 Len=1382 [TCP segment of a reassembled PDU]"
"52","0.012813","176.235.75.83","172.16.7.65","TCP","1436","443  >  54052 [ACK] Seq=53978 Ack=3867 Win=521 Len=1382 [TCP segment of a reassembled PDU]"
"53","0.012813","176.235.75.83","172.16.7.65","TCP","1436","443  >  54052 [ACK] Seq=55360 Ack=3867 Win=521 Len=1382 [TCP segment of a reassembled PDU]"
"54","0.012813","176.235.75.83","172.16.7.65","TCP","1436","443  >  54052 [ACK] Seq=56742 Ack=3867 Win=521 Len=1382 [TCP segment of a reassembled PDU]"
"55","0.012813","176.235.75.83","172.16.7.65","TCP","1436","443  >  54052 [ACK] Seq=58124 Ack=3867 Win=521 Len=1382 [TCP segment of a reassembled PDU]"
"56","0.012813","176.235.75.83","172.16.7.65","TCP","1436","443  >  54052 [ACK] Seq=59506 Ack=3867 Win=521 Len=1382 [TCP segment of a reassembled PDU]"
"57","0.012813","176.235.75.83","172.16.7.65","TCP","1436","443  >  54052 [ACK] Seq=60888 Ack=3867 Win=521 Len=1382 [TCP segment of a reassembled PDU]"
"59","0.013052","176.235.75.83","172.16.7.65","TCP","1436","443  >  54052 [ACK] Seq=62270 Ack=3867 Win=521 Len=1382 [TCP segment of a reassembled PDU]"
"60","0.013052","176.235.75.83","172.16.7.65","TCP","1436","443  >  54052 [ACK] Seq=63652 Ack=3867 Win=521 Len=1382 [TCP segment of a reassembled PDU]"
"61","0.013052","176.235.75.83","172.16.7.65","TCP","1436","443  >  54052 [ACK] Seq=65034 Ack=3867 Win=521 Len=1382 [TCP segment of a reassembled PDU]"
"62","0.013052","176.235.75.83","172.16.7.65","TLSv1.2","1436","Application Data"
"63","0.013052","176.235.75.83","172.16.7.65","TCP","1436","443  >  54052 [ACK] Seq=67798 Ack=3867 Win=521 Len=1382 [TCP segment of a reassembled PDU]"
"64","0.013052","176.235.75.83","172.16.7.65","TCP","1436","443  >  54052 [ACK] Seq=69180 Ack=3867 Win=521 Len=1382 [TCP segment of a reassembled PDU]"
"65","0.013052","176.235.75.83","172.16.7.65","TCP","1436","443  >  54052 [ACK] Seq=70562 Ack=3867 Win=521 Len=1382 [TCP segment of a reassembled PDU]"
"66","0.013052","176.235.75.83","172.16.7.65","TCP","1436","443  >  54052 [ACK] Seq=71944 Ack=3867 Win=521 Len=1382 [TCP segment of a reassembled PDU]"
"68","0.014355","176.235.75.83","172.16.7.65","TCP","1436","443  >  54052 [ACK] Seq=73326 Ack=3867 Win=521 Len=1382 [TCP segment of a reassembled PDU]"
"69","0.014355","176.235.75.83","172.16.7.65","TCP","1436","443  >  54052 [PSH, ACK] Seq=74708 Ack=3867 Win=521 Len=1382 [TCP segment of a reassembled PDU]"
"70","0.014355","176.235.75.83","172.16.7.65","TCP","1436","443  >  54052 [ACK] Seq=76090 Ack=3867 Win=521 Len=1382 [TCP segment of a reassembled PDU]"
"71","0.014355","176.235.75.83","172.16.7.65","TCP","1436","443  >  54052 [ACK] Seq=77472 Ack=3867 Win=521 Len=1382 [TCP segment of a reassembled PDU]"
"72","0.014355","176.235.75.83","172.16.7.65","TCP","1436","443  >  54052 [ACK] Seq=78854 Ack=3867 Win=521 Len=1382 [TCP segment of a reassembled PDU]"
"73","0.014355","176.235.75.83","172.16.7.65","TCP","1436","443  >  54052 [ACK] Seq=80236 Ack=3867 Win=521 Len=1382 [TCP segment of a reassembled PDU]"
"74","0.014355","176.235.75.83","172.16.7.65","TCP","1436","443  >  54052 [ACK] Seq=81618 Ack=3867 Win=521 Len=1382 [TCP segment of a reassembled PDU]"
"75","0.014355","176.235.75.83","172.16.7.65","TLSv1.2","1436","Application Data"
"76","0.014355","176.235.75.83","172.16.7.65","TCP","1436","443  >  54052 [ACK] Seq=84382 Ack=3867 Win=521 Len=1382 [TCP segment of a reassembled PDU]"
"77","0.014355","176.235.75.83","172.16.7.65","TCP","1436","443  >  54052 [ACK] Seq=85764 Ack=3867 Win=521 Len=1382 [TCP segment of a reassembled PDU]"
"78","0.014355","176.235.75.83","172.16.7.65","TCP","1436","443  >  54052 [ACK] Seq=87146 Ack=3867 Win=521 Len=1382 [TCP segment of a reassembled PDU]"
"79","0.014355","176.235.75.83","172.16.7.65","TCP","1436","443  >  54052 [ACK] Seq=88528 Ack=3867 Win=521 Len=1382 [TCP segment of a reassembled PDU]"
"80","0.014355","176.235.75.83","172.16.7.65","TCP","1436","443  >  54052 [PSH, ACK] Seq=89910 Ack=3867 Win=521 Len=1382 [TCP segment of a reassembled PDU]"
"81","0.014355","176.235.75.83","172.16.7.65","TCP","1436","443  >  54052 [ACK] Seq=91292 Ack=3867 Win=521 Len=1382 [TCP segment of a reassembled PDU]"
"82","0.014355","176.235.75.83","172.16.7.65","TCP","1436","443  >  54052 [ACK] Seq=92674 Ack=3867 Win=521 Len=1382 [TCP segment of a reassembled PDU]"
"83","0.014355","176.235.75.83","172.16.7.65","TCP","1436","443  >  54052 [ACK] Seq=94056 Ack=3867 Win=521 Len=1382 [TCP segment of a reassembled PDU]"
"84","0.014355","176.235.75.83","172.16.7.65","TCP","1436","443  >  54052 [ACK] Seq=95438 Ack=3867 Win=521 Len=1382 [TCP segment of a reassembled PDU]"
"85","0.014355","176.235.75.83","172.16.7.65","TCP","1436","443  >  54052 [ACK] Seq=96820 Ack=3867 Win=521 Len=1382 [TCP segment of a reassembled PDU]"
"86","0.014355","176.235.75.83","172.16.7.65","TCP","1436","443  >  54052 [ACK] Seq=98202 Ack=3867 Win=521 Len=1382 [TCP segment of a reassembled PDU]"
"87","0.014355","176.235.75.83","172.16.7.65","TLSv1.2","1436","Application Data"
"88","0.014355","176.235.75.83","172.16.7.65","TCP","1436","443  >  54052 [ACK] Seq=100966 Ack=3867 Win=521 Len=1382 [TCP segment of a reassembled PDU]"
"89","0.014355","176.235.75.83","172.16.7.65","TCP","1436","443  >  54052 [ACK] Seq=102348 Ack=3867 Win=521 Len=1382 [TCP segment of a reassembled PDU]"
"90","0.014355","176.235.75.83","172.16.7.65","TCP","1436","443  >  54052 [ACK] Seq=103730 Ack=3867 Win=521 Len=1382 [TCP segment of a reassembled PDU]"
"91","0.014355","176.235.75.83","172.16.7.65","TCP","1436","443  >  54052 [ACK] Seq=105112 Ack=3867 Win=521 Len=1382 [TCP segment of a reassembled PDU]"
"92","0.014355","176.235.75.83","172.16.7.65","TCP","1436","443  >  54052 [ACK] Seq=106494 Ack=3867 Win=521 Len=1382 [TCP segment of a reassembled PDU]"
"93","0.014355","176.235.75.83","172.16.7.65","TCP","1436","443  >  54052 [ACK] Seq=107876 Ack=3867 Win=521 Len=1382 [TCP segment of a reassembled PDU]"
"94","0.014355","176.235.75.83","172.16.7.65","TCP","1436","443  >  54052 [ACK] Seq=109258 Ack=3867 Win=521 Len=1382 [TCP segment of a reassembled PDU]"
"95","0.014355","176.235.75.83","172.16.7.65","TCP","1436","443  >  54052 [ACK] Seq=110640 Ack=3867 Win=521 Len=1382 [TCP segment of a reassembled PDU]"
"96","0.014355","176.235.75.83","172.16.7.65","TCP","1436","443  >  54052 [ACK] Seq=112022 Ack=3867 Win=521 Len=1382 [TCP segment of a reassembled PDU]"
"98","0.015351","176.235.75.83","172.16.7.65","TCP","1436","443  >  54052 [ACK] Seq=113404 Ack=3867 Win=521 Len=1382 [TCP segment of a reassembled PDU]"
"99","0.015351","176.235.75.83","172.16.7.65","TCP","1436","443  >  54052 [PSH, ACK] Seq=114786 Ack=3867 Win=521 Len=1382 [TCP segment of a reassembled PDU]"
"100","0.015351","176.235.75.83","172.16.7.65","TLSv1.2","1436","Application Data"
"101","0.015351","176.235.75.83","172.16.7.65","TCP","1436","443  >  54052 [ACK] Seq=117550 Ack=3867 Win=521 Len=1382 [TCP segment of a reassembled PDU]"
"102","0.015351","176.235.75.83","172.16.7.65","TCP","1436","443  >  54052 [ACK] Seq=118932 Ack=3867 Win=521 Len=1382 [TCP segment of a reassembled PDU]"
"103","0.015351","176.235.75.83","172.16.7.65","TCP","1436","443  >  54052 [ACK] Seq=120314 Ack=3867 Win=521 Len=1382 [TCP segment of a reassembled PDU]"
"104","0.015351","176.235.75.83","172.16.7.65","TCP","1436","443  >  54052 [ACK] Seq=121696 Ack=3867 Win=521 Len=1382 [TCP segment of a reassembled PDU]"
"105","0.015351","176.235.75.83","172.16.7.65","TCP","1436","443  >  54052 [ACK] Seq=123078 Ack=3867 Win=521 Len=1382 [TCP segment of a reassembled PDU]"
"106","0.015351","176.235.75.83","172.16.7.65","TCP","1436","443  >  54052 [ACK] Seq=124460 Ack=3867 Win=521 Len=1382 [TCP segment of a reassembled PDU]"
"107","0.015351","176.235.75.83","172.16.7.65","TCP","1436","443  >  54052 [ACK] Seq=125842 Ack=3867 Win=521 Len=1382 [TCP segment of a reassembled PDU]"
"108","0.015351","176.235.75.83","172.16.7.65","TCP","1436","443  >  54052 [ACK] Seq=127224 Ack=3867 Win=521 Len=1382 [TCP segment of a reassembled PDU]"
"109","0.015351","176.235.75.83","172.16.7.65","TCP","1436","443  >  54052 [ACK] Seq=128606 Ack=3867 Win=521 Len=1382 [TCP segment of a reassembled PDU]"
"110","0.015351","176.235.75.83","172.16.7.65","TCP","1436","443  >  54052 [ACK] Seq=129988 Ack=3867 Win=521 Len=1382 [TCP segment of a reassembled PDU]"
"111","0.015351","176.235.75.83","172.16.7.65","TCP","1436","443  >  54052 [ACK] Seq=131370 Ack=3867 Win=521 Len=1382 [TCP segment of a reassembled PDU]"
"112","0.015351","176.235.75.83","172.16.7.65","TLSv1.2","1436","Application Data"
"113","0.015351","176.235.75.83","172.16.7.65","TCP","1436","443  >  54052 [ACK] Seq=134134 Ack=3867 Win=521 Len=1382 [TCP segment of a reassembled PDU]"
"114","0.015351","176.235.75.83","172.16.7.65","TCP","1436","443  >  54052 [ACK] Seq=135516 Ack=3867 Win=521 Len=1382 [TCP segment of a reassembled PDU]"
"115","0.015351","176.235.75.83","172.16.7.65","TCP","1436","443  >  54052 [ACK] Seq=136898 Ack=3867 Win=521 Len=1382 [TCP segment of a reassembled PDU]"
"116","0.015351","176.235.75.83","172.16.7.65","TCP","1436","443  >  54052 [ACK] Seq=138280 Ack=3867 Win=521 Len=1382 [TCP segment of a reassembled PDU]"
"118","0.016837","176.235.75.83","172.16.7.65","TCP","1436","443  >  54052 [PSH, ACK] Seq=139662 Ack=3867 Win=521 Len=1382 [TCP segment of a reassembled PDU]"
"119","0.016837","176.235.75.83","172.16.7.65","TCP","1436","443  >  54052 [ACK] Seq=141044 Ack=3867 Win=521 Len=1382 [TCP segment of a reassembled PDU]"
"120","0.016837","176.235.75.83","172.16.7.65","TCP","1436","443  >  54052 [ACK] Seq=142426 Ack=3867 Win=521 Len=1382 [TCP segment of a reassembled PDU]"
"121","0.016837","176.235.75.83","172.16.7.65","TCP","1436","443  >  54052 [ACK] Seq=143808 Ack=3867 Win=521 Len=1382 [TCP segment of a reassembled PDU]"
"122","0.016837","176.235.75.83","172.16.7.65","TCP","1436","443  >  54052 [ACK] Seq=145190 Ack=3867 Win=521 Len=1382 [TCP segment of a reassembled PDU]"
"123","0.016837","176.235.75.83","172.16.7.65","TCP","1436","443  >  54052 [ACK] Seq=146572 Ack=3867 Win=521 Len=1382 [TCP segment of a reassembled PDU]"
"124","0.016837","176.235.75.83","172.16.7.65","TLSv1.2","1436","Application Data"
"125","0.016837","176.235.75.83","172.16.7.65","TCP","1436","443  >  54052 [ACK] Seq=149336 Ack=3867 Win=521 Len=1382 [TCP segment of a reassembled PDU]"
"126","0.016837","176.235.75.83","172.16.7.65","TCP","1436","443  >  54052 [ACK] Seq=150718 Ack=3867 Win=521 Len=1382 [TCP segment of a reassembled PDU]"
"127","0.016837","176.235.75.83","172.16.7.65","TCP","1436","443  >  54052 [ACK] Seq=152100 Ack=3867 Win=521 Len=1382 [TCP segment of a reassembled PDU]"
"128","0.016837","176.235.75.83","172.16.7.65","TCP","1436","443  >  54052 [ACK] Seq=153482 Ack=3867 Win=521 Len=1382 [TCP segment of a reassembled PDU]"
"129","0.016837","176.235.75.83","172.16.7.65","TCP","1436","443  >  54052 [PSH, ACK] Seq=154864 Ack=3867 Win=521 Len=1382 [TCP segment of a reassembled PDU]"
"130","0.016837","176.235.75.83","172.16.7.65","TCP","1436","443  >  54052 [ACK] Seq=156246 Ack=3867 Win=521 Len=1382 [TCP segment of a reassembled PDU]"
"131","0.016837","176.235.75.83","172.16.7.65","TCP","1436","443  >  54052 [ACK] Seq=157628 Ack=3867 Win=521 Len=1382 [TCP segment of a reassembled PDU]"
"132","0.016837","176.235.75.83","172.16.7.65","TCP","1436","443  >  54052 [ACK] Seq=159010 Ack=3867 Win=521 Len=1382 [TCP segment of a reassembled PDU]"
"133","0.016837","176.235.75.83","172.16.7.65","TCP","1436","443  >  54052 [ACK] Seq=160392 Ack=3867 Win=521 Len=1382 [TCP segment of a reassembled PDU]"
"134","0.016837","176.235.75.83","172.16.7.65","TCP","1436","443  >  54052 [ACK] Seq=161774 Ack=3867 Win=521 Len=1382 [TCP segment of a reassembled PDU]"
"135","0.016837","176.235.75.83","172.16.7.65","TCP","1436","443  >  54052 [ACK] Seq=163156 Ack=3867 Win=521 Len=1382 [TCP segment of a reassembled PDU]"
"136","0.016837","176.235.75.83","172.16.7.65","TLSv1.2","1436","Application Data"
"137","0.016837","176.235.75.83","172.16.7.65","TCP","1436","443  >  54052 [ACK] Seq=165920 Ack=3867 Win=521 Len=1382 [TCP segment of a reassembled PDU]"
"138","0.016837","176.235.75.83","172.16.7.65","TCP","1436","443  >  54052 [ACK] Seq=167302 Ack=3867 Win=521 Len=1382 [TCP segment of a reassembled PDU]"
"139","0.016837","176.235.75.83","172.16.7.65","TCP","1436","443  >  54052 [ACK] Seq=168684 Ack=3867 Win=521 Len=1382 [TCP segment of a reassembled PDU]"
"140","0.016837","176.235.75.83","172.16.7.65","TCP","1436","443  >  54052 [ACK] Seq=170066 Ack=3867 Win=521 Len=1382 [TCP segment of a reassembled PDU]"
"141","0.016837","176.235.75.83","172.16.7.65","TCP","1436","443  >  54052 [ACK] Seq=171448 Ack=3867 Win=521 Len=1382 [TCP segment of a reassembled PDU]"
"142","0.016837","176.235.75.83","172.16.7.65","TCP","1436","443  >  54052 [ACK] Seq=172830 Ack=3867 Win=521 Len=1382 [TCP segment of a reassembled PDU]"
"143","0.016837","176.235.75.83","172.16.7.65","TCP","1436","443  >  54052 [ACK] Seq=174212 Ack=3867 Win=521 Len=1382 [TCP segment of a reassembled PDU]"
"144","0.016837","176.235.75.83","172.16.7.65","TCP","1436","443  >  54052 [ACK] Seq=175594 Ack=3867 Win=521 Len=1382 [TCP segment of a reassembled PDU]"
"145","0.016837","176.235.75.83","172.16.7.65","TCP","1436","443  >  54052 [ACK] Seq=176976 Ack=3867 Win=521 Len=1382 [TCP segment of a reassembled PDU]"
"147","0.017497","176.235.75.83","172.16.7.65","TCP","1436","443  >  54052 [ACK] Seq=178358 Ack=3867 Win=521 Len=1382 [TCP segment of a reassembled PDU]"
"148","0.017497","176.235.75.83","172.16.7.65","TCP","1436","443  >  54052 [PSH, ACK] Seq=179740 Ack=3867 Win=521 Len=1382 [TCP segment of a reassembled PDU]"
"149","0.017497","176.235.75.83","172.16.7.65","TLSv1.2","1436","Application Data"
"150","0.017497","176.235.75.83","172.16.7.65","TCP","1436","443  >  54052 [ACK] Seq=182504 Ack=3867 Win=521 Len=1382 [TCP segment of a reassembled PDU]"
"151","0.017497","176.235.75.83","172.16.7.65","TCP","1436","443  >  54052 [ACK] Seq=183886 Ack=3867 Win=521 Len=1382 [TCP segment of a reassembled PDU]"
"152","0.017497","176.235.75.83","172.16.7.65","TCP","1436","443  >  54052 [ACK] Seq=185268 Ack=3867 Win=521 Len=1382 [TCP segment of a reassembled PDU]"
"153","0.017497","176.235.75.83","172.16.7.65","TCP","1436","443  >  54052 [ACK] Seq=186650 Ack=3867 Win=521 Len=1382 [TCP segment of a reassembled PDU]"
"154","0.017497","176.235.75.83","172.16.7.65","TCP","1436","443  >  54052 [ACK] Seq=188032 Ack=3867 Win=521 Len=1382 [TCP segment of a reassembled PDU]"
"155","0.017497","176.235.75.83","172.16.7.65","TCP","1436","443  >  54052 [ACK] Seq=189414 Ack=3867 Win=521 Len=1382 [TCP segment of a reassembled PDU]"
"156","0.017497","176.235.75.83","172.16.7.65","TCP","1436","443  >  54052 [ACK] Seq=190796 Ack=3867 Win=521 Len=1382 [TCP segment of a reassembled PDU]"
"157","0.017497","176.235.75.83","172.16.7.65","TCP","1436","443  >  54052 [ACK] Seq=192178 Ack=3867 Win=521 Len=1382 [TCP segment of a reassembled PDU]"
"158","0.017497","176.235.75.83","172.16.7.65","TCP","1436","443  >  54052 [ACK] Seq=193560 Ack=3867 Win=521 Len=1382 [TCP segment of a reassembled PDU]"
"159","0.017497","176.235.75.83","172.16.7.65","TCP","1436","443  >  54052 [ACK] Seq=194942 Ack=3867 Win=521 Len=1382 [TCP segment of a reassembled PDU]"
"160","0.017497","176.235.75.83","172.16.7.65","TCP","1436","443  >  54052 [ACK] Seq=196324 Ack=3867 Win=521 Len=1382 [TCP segment of a reassembled PDU]"
"161","0.017497","176.235.75.83","172.16.7.65","TLSv1.2","1436","Application Data"
"162","0.017497","176.235.75.83","172.16.7.65","TCP","1436","443  >  54052 [ACK] Seq=199088 Ack=3867 Win=521 Len=1382 [TCP segment of a reassembled PDU]"
"164","0.018966","176.235.75.83","172.16.7.65","TCP","1436","443  >  54052 [ACK] Seq=200470 Ack=3867 Win=521 Len=1382 [TCP segment of a reassembled PDU]"
"165","0.018966","176.235.75.83","172.16.7.65","TCP","1436","443  >  54052 [ACK] Seq=201852 Ack=3867 Win=521 Len=1382 [TCP segment of a reassembled PDU]"
"166","0.018966","176.235.75.83","172.16.7.65","TCP","1436","443  >  54052 [ACK] Seq=203234 Ack=3867 Win=521 Len=1382 [TCP segment of a reassembled PDU]"
"167","0.018966","176.235.75.83","172.16.7.65","TCP","1436","443  >  54052 [PSH, ACK] Seq=204616 Ack=3867 Win=521 Len=1382 [TCP segment of a reassembled PDU]"
"168","0.018966","176.235.75.83","172.16.7.65","TCP","1436","443  >  54052 [ACK] Seq=205998 Ack=3867 Win=521 Len=1382 [TCP segment of a reassembled PDU]"
"169","0.018966","176.235.75.83","172.16.7.65","TCP","1436","443  >  54052 [ACK] Seq=207380 Ack=3867 Win=521 Len=1382 [TCP segment of a reassembled PDU]"
"170","0.018966","176.235.75.83","172.16.7.65","TCP","1436","443  >  54052 [ACK] Seq=208762 Ack=3867 Win=521 Len=1382 [TCP segment of a reassembled PDU]"
"171","0.018966","176.235.75.83","172.16.7.65","TCP","1436","443  >  54052 [ACK] Seq=210144 Ack=3867 Win=521 Len=1382 [TCP segment of a reassembled PDU]"
"172","0.018966","176.235.75.83","172.16.7.65","TCP","1436","443  >  54052 [ACK] Seq=211526 Ack=3867 Win=521 Len=1382 [TCP segment of a reassembled PDU]"
"174","0.019388","176.235.75.83","172.16.7.65","TCP","1436","443  >  54052 [ACK] Seq=212908 Ack=3867 Win=521 Len=1382 [TCP segment of a reassembled PDU]"
"175","0.019388","176.235.75.83","172.16.7.65","TLSv1.2","1436","Application Data"
"176","0.019388","176.235.75.83","172.16.7.65","TCP","1436","443  >  54052 [ACK] Seq=215672 Ack=3867 Win=521 Len=1382 [TCP segment of a reassembled PDU]"
"177","0.019388","176.235.75.83","172.16.7.65","TCP","1436","443  >  54052 [ACK] Seq=217054 Ack=3867 Win=521 Len=1382 [TCP segment of a reassembled PDU]"
"178","0.019388","176.235.75.83","172.16.7.65","TCP","1436","443  >  54052 [ACK] Seq=218436 Ack=3867 Win=521 Len=1382 [TCP segment of a reassembled PDU]"
"179","0.019388","176.235.75.83","172.16.7.65","TCP","1436","443  >  54052 [PSH, ACK] Seq=219818 Ack=3867 Win=521 Len=1382 [TCP segment of a reassembled PDU]"
"180","0.019388","176.235.75.83","172.16.7.65","TCP","1436","443  >  54052 [ACK] Seq=221200 Ack=3867 Win=521 Len=1382 [TCP segment of a reassembled PDU]"
"181","0.019388","176.235.75.83","172.16.7.65","TCP","1436","443  >  54052 [ACK] Seq=222582 Ack=3867 Win=521 Len=1382 [TCP segment of a reassembled PDU]"
"182","0.019388","176.235.75.83","172.16.7.65","TCP","1436","443  >  54052 [ACK] Seq=223964 Ack=3867 Win=521 Len=1382 [TCP segment of a reassembled PDU]"
"183","0.019388","176.235.75.83","172.16.7.65","TCP","1436","443  >  54052 [ACK] Seq=225346 Ack=3867 Win=521 Len=1382 [TCP segment of a reassembled PDU]"
"184","0.019388","176.235.75.83","172.16.7.65","TCP","1436","443  >  54052 [ACK] Seq=226728 Ack=3867 Win=521 Len=1382 [TCP segment of a reassembled PDU]"
"185","0.019388","176.235.75.83","172.16.7.65","TCP","1436","443  >  54052 [ACK] Seq=228110 Ack=3867 Win=521 Len=1382 [TCP segment of a reassembled PDU]"
"186","0.019388","176.235.75.83","172.16.7.65","TCP","1436","443  >  54052 [ACK] Seq=229492 Ack=3867 Win=521 Len=1382 [TCP segment of a reassembled PDU]"
"187","0.019388","176.235.75.83","172.16.7.65","TLSv1.2","1436","Application Data"
"188","0.019388","176.235.75.83","172.16.7.65","TCP","1436","443  >  54052 [ACK] Seq=232256 Ack=3867 Win=521 Len=1382 [TCP segment of a reassembled PDU]"
"189","0.019388","176.235.75.83","172.16.7.65","TCP","1436","443  >  54052 [ACK] Seq=233638 Ack=3867 Win=521 Len=1382 [TCP segment of a reassembled PDU]"
"190","0.019388","176.235.75.83","172.16.7.65","TCP","1436","443  >  54052 [ACK] Seq=235020 Ack=3867 Win=521 Len=1382 [TCP segment of a reassembled PDU]"
"191","0.019388","176.235.75.83","172.16.7.65","TCP","1436","443  >  54052 [ACK] Seq=236402 Ack=3867 Win=521 Len=1382 [TCP segment of a reassembled PDU]"
"192","0.019388","176.235.75.83","172.16.7.65","TCP","1436","443  >  54052 [ACK] Seq=237784 Ack=3867 Win=521 Len=1382 [TCP segment of a reassembled PDU]"
"193","0.019388","176.235.75.83","172.16.7.65","TCP","1436","443  >  54052 [ACK] Seq=239166 Ack=3867 Win=521 Len=1382 [TCP segment of a reassembled PDU]"
"194","0.019388","176.235.75.83","172.16.7.65","TCP","1436","443  >  54052 [ACK] Seq=240548 Ack=3867 Win=521 Len=1382 [TCP segment of a reassembled PDU]"
"195","0.019388","176.235.75.83","172.16.7.65","TCP","1436","443  >  54052 [ACK] Seq=241930 Ack=3867 Win=521 Len=1382 [TCP segment of a reassembled PDU]"
"197","0.020473","176.235.75.83","172.16.7.65","TCP","1436","443  >  54052 [ACK] Seq=243312 Ack=3867 Win=521 Len=1382 [TCP segment of a reassembled PDU]"
"198","0.020473","176.235.75.83","172.16.7.65","TCP","1436","443  >  54052 [PSH, ACK] Seq=244694 Ack=3867 Win=521 Len=1382 [TCP segment of a reassembled PDU]"
"199","0.020473","176.235.75.83","172.16.7.65","TCP","1436","443  >  54052 [ACK] Seq=246076 Ack=3867 Win=521 Len=1382 [TCP segment of a reassembled PDU]"
"200","0.020473","176.235.75.83","172.16.7.65","TLSv1.2","1436","Application Data"
"201","0.020473","176.235.75.83","172.16.7.65","TCP","1436","443  >  54052 [ACK] Seq=248840 Ack=3867 Win=521 Len=1382 [TCP segment of a reassembled PDU]"
"202","0.020473","176.235.75.83","172.16.7.65","TCP","1436","443  >  54052 [ACK] Seq=250222 Ack=3867 Win=521 Len=1382 [TCP segment of a reassembled PDU]"
"203","0.020473","176.235.75.83","172.16.7.65","TCP","1436","443  >  54052 [ACK] Seq=251604 Ack=3867 Win=521 Len=1382 [TCP segment of a reassembled PDU]"
"204","0.020473","176.235.75.83","172.16.7.65","TCP","1436","443  >  54052 [ACK] Seq=252986 Ack=3867 Win=521 Len=1382 [TCP segment of a reassembled PDU]"
"205","0.020473","176.235.75.83","172.16.7.65","TCP","1436","443  >  54052 [ACK] Seq=254368 Ack=3867 Win=521 Len=1382 [TCP segment of a reassembled PDU]"
"206","0.020473","176.235.75.83","172.16.7.65","TCP","1436","443  >  54052 [ACK] Seq=255750 Ack=3867 Win=521 Len=1382 [TCP segment of a reassembled PDU]"
"207","0.020473","176.235.75.83","172.16.7.65","TCP","1436","443  >  54052 [ACK] Seq=257132 Ack=3867 Win=521 Len=1382 [TCP segment of a reassembled PDU]"
"208","0.020473","176.235.75.83","172.16.7.65","TCP","1436","443  >  54052 [ACK] Seq=258514 Ack=3867 Win=521 Len=1382 [TCP segment of a reassembled PDU]"
"209","0.020473","176.235.75.83","172.16.7.65","TCP","1436","443  >  54052 [ACK] Seq=259896 Ack=3867 Win=521 Len=1382 [TCP segment of a reassembled PDU]"
"210","0.020473","176.235.75.83","172.16.7.65","TCP","1436","443  >  54052 [ACK] Seq=261278 Ack=3867 Win=521 Len=1382 [TCP segment of a reassembled PDU]"
"211","0.020473","176.235.75.83","172.16.7.65","TCP","1436","443  >  54052 [ACK] Seq=262660 Ack=3867 Win=521 Len=1382 [TCP segment of a reassembled PDU]"
"212","0.020473","176.235.75.83","172.16.7.65","TLSv1.2","1436","Application Data, Application Data, Application Data, Application Data, Application Data, Application Data, Application Data"
"213","0.020473","176.235.75.83","172.16.7.65","TCP","1436","443  >  54052 [ACK] Seq=265424 Ack=3867 Win=521 Len=1382 [TCP segment of a reassembled PDU]"
"214","0.020473","176.235.75.83","172.16.7.65","TCP","1436","443  >  54052 [ACK] Seq=266806 Ack=3867 Win=521 Len=1382 [TCP segment of a reassembled PDU]"
"215","0.020473","176.235.75.83","172.16.7.65","TCP","1436","443  >  54052 [ACK] Seq=268188 Ack=3867 Win=521 Len=1382 [TCP segment of a reassembled PDU]"
"216","0.020473","176.235.75.83","172.16.7.65","TCP","1436","443  >  54052 [PSH, ACK] Seq=269570 Ack=3867 Win=521 Len=1382 [TCP segment of a reassembled PDU]"
"217","0.020473","176.235.75.83","172.16.7.65","TCP","1436","443  >  54052 [ACK] Seq=270952 Ack=3867 Win=521 Len=1382 [TCP segment of a reassembled PDU]"
"218","0.020473","176.235.75.83","172.16.7.65","TCP","1436","443  >  54052 [ACK] Seq=272334 Ack=3867 Win=521 Len=1382 [TCP segment of a reassembled PDU]"
"219","0.020473","176.235.75.83","172.16.7.65","TCP","1436","443  >  54052 [ACK] Seq=273716 Ack=3867 Win=521 Len=1382 [TCP segment of a reassembled PDU]"
"220","0.020473","176.235.75.83","172.16.7.65","TCP","1436","443  >  54052 [ACK] Seq=275098 Ack=3867 Win=521 Len=1382 [TCP segment of a reassembled PDU]"
"221","0.020473","176.235.75.83","172.16.7.65","TCP","1436","443  >  54052 [ACK] Seq=276480 Ack=3867 Win=521 Len=1382 [TCP segment of a reassembled PDU]"
"222","0.020473","176.235.75.83","172.16.7.65","TCP","1436","443  >  54052 [ACK] Seq=277862 Ack=3867 Win=521 Len=1382 [TCP segment of a reassembled PDU]"
"223","0.020473","176.235.75.83","172.16.7.65","TCP","1436","443  >  54052 [ACK] Seq=279244 Ack=3867 Win=521 Len=1382 [TCP segment of a reassembled PDU]"
"224","0.020473","176.235.75.83","172.16.7.65","TLSv1.2","1436","Application Data"
"225","0.020473","176.235.75.83","172.16.7.65","TCP","1436","443  >  54052 [ACK] Seq=282008 Ack=3867 Win=521 Len=1382 [TCP segment of a reassembled PDU]"
"227","0.021272","176.235.75.83","172.16.7.65","TCP","1436","443  >  54052 [ACK] Seq=283390 Ack=3867 Win=521 Len=1382 [TCP segment of a reassembled PDU]"
"228","0.021272","176.235.75.83","172.16.7.65","TCP","1436","443  >  54052 [PSH, ACK] Seq=284772 Ack=3867 Win=521 Len=1382 [TCP segment of a reassembled PDU]"
"229","0.021272","176.235.75.83","172.16.7.65","TCP","1436","443  >  54052 [ACK] Seq=286154 Ack=3867 Win=521 Len=1382 [TCP segment of a reassembled PDU]"
"230","0.021272","176.235.75.83","172.16.7.65","TCP","1436","443  >  54052 [ACK] Seq=287536 Ack=3867 Win=521 Len=1382 [TCP segment of a reassembled PDU]"
"231","0.021272","176.235.75.83","172.16.7.65","TCP","1436","443  >  54052 [ACK] Seq=288918 Ack=3867 Win=521 Len=1382 [TCP segment of a reassembled PDU]"
"232","0.021272","176.235.75.83","172.16.7.65","TCP","1436","443  >  54052 [ACK] Seq=290300 Ack=3867 Win=521 Len=1382 [TCP segment of a reassembled PDU]"
"233","0.021272","176.235.75.83","172.16.7.65","TCP","1436","443  >  54052 [ACK] Seq=291682 Ack=3867 Win=521 Len=1382 [TCP segment of a reassembled PDU]"
"234","0.021272","176.235.75.83","172.16.7.65","TCP","1436","443  >  54052 [ACK] Seq=293064 Ack=3867 Win=521 Len=1382 [TCP segment of a reassembled PDU]"
"235","0.021272","176.235.75.83","172.16.7.65","TCP","1436","443  >  54052 [ACK] Seq=294446 Ack=3867 Win=521 Len=1382 [TCP segment of a reassembled PDU]"
"236","0.021272","176.235.75.83","172.16.7.65","TLSv1.2","1436","Application Data"
"237","0.021272","176.235.75.83","172.16.7.65","TCP","1436","443  >  54052 [ACK] Seq=297210 Ack=3867 Win=521 Len=1382 [TCP segment of a reassembled PDU]"
"238","0.021272","176.235.75.83","172.16.7.65","TCP","1436","443  >  54052 [ACK] Seq=298592 Ack=3867 Win=521 Len=1382 [TCP segment of a reassembled PDU]"
"239","0.021272","176.235.75.83","172.16.7.65","TCP","1436","443  >  54052 [ACK] Seq=299974 Ack=3867 Win=521 Len=1382 [TCP segment of a reassembled PDU]"
"240","0.021272","176.235.75.83","172.16.7.65","TCP","1436","443  >  54052 [ACK] Seq=301356 Ack=3867 Win=521 Len=1382 [TCP segment of a reassembled PDU]"
"241","0.021272","176.235.75.83","172.16.7.65","TCP","1436","443  >  54052 [ACK] Seq=302738 Ack=3867 Win=521 Len=1382 [TCP segment of a reassembled PDU]"
"242","0.021272","176.235.75.83","172.16.7.65","TCP","1436","443  >  54052 [ACK] Seq=304120 Ack=3867 Win=521 Len=1382 [TCP segment of a reassembled PDU]"
"243","0.021272","176.235.75.83","172.16.7.65","TCP","1436","443  >  54052 [ACK] Seq=305502 Ack=3867 Win=521 Len=1382 [TCP segment of a reassembled PDU]"
"245","0.021577","176.235.75.83","172.16.7.65","TCP","1436","443  >  54052 [ACK] Seq=306884 Ack=3867 Win=521 Len=1382 [TCP segment of a reassembled PDU]"
"246","0.021577","176.235.75.83","172.16.7.65","TCP","1436","443  >  54052 [ACK] Seq=308266 Ack=3867 Win=521 Len=1382 [TCP segment of a reassembled PDU]"
"247","0.021577","176.235.75.83","172.16.7.65","TCP","1436","443  >  54052 [ACK] Seq=309648 Ack=3867 Win=521 Len=1382 [TCP segment of a reassembled PDU]"
"249","0.021701","176.235.75.83","172.16.7.65","TCP","1436","443  >  54052 [ACK] Seq=311030 Ack=3867 Win=521 Len=1382 [TCP segment of a reassembled PDU]"
"250","0.021701","176.235.75.83","172.16.7.65","TLSv1.2","1436","Application Data"
"251","0.021701","176.235.75.83","172.16.7.65","TCP","1436","443  >  54052 [ACK] Seq=313794 Ack=3867 Win=521 Len=1382 [TCP segment of a reassembled PDU]"
"252","0.021701","176.235.75.83","172.16.7.65","TCP","1436","443  >  54052 [ACK] Seq=315176 Ack=3867 Win=521 Len=1382 [TCP segment of a reassembled PDU]"
"254","0.022947","176.235.75.83","172.16.7.65","TCP","1436","443  >  54052 [PSH, ACK] Seq=316558 Ack=3867 Win=521 Len=1382 [TCP segment of a reassembled PDU]"
"255","0.022947","176.235.75.83","172.16.7.65","TCP","1436","443  >  54052 [ACK] Seq=317940 Ack=3867 Win=521 Len=1382 [TCP segment of a reassembled PDU]"
"256","0.022947","176.235.75.83","172.16.7.65","TCP","1436","443  >  54052 [ACK] Seq=319322 Ack=3867 Win=521 Len=1382 [TCP segment of a reassembled PDU]"
"257","0.022947","176.235.75.83","172.16.7.65","TCP","1436","443  >  54052 [ACK] Seq=320704 Ack=3867 Win=521 Len=1382 [TCP segment of a reassembled PDU]"
"258","0.022947","176.235.75.83","172.16.7.65","TCP","1436","443  >  54052 [ACK] Seq=322086 Ack=3867 Win=521 Len=1382 [TCP segment of a reassembled PDU]"
"259","0.022947","176.235.75.83","172.16.7.65","TCP","1436","443  >  54052 [ACK] Seq=323468 Ack=3867 Win=521 Len=1382 [TCP segment of a reassembled PDU]"
"260","0.022947","176.235.75.83","172.16.7.65","TCP","1436","443  >  54052 [ACK] Seq=324850 Ack=3867 Win=521 Len=1382 [TCP segment of a reassembled PDU]"
"261","0.022947","176.235.75.83","172.16.7.65","TCP","1436","443  >  54052 [ACK] Seq=326232 Ack=3867 Win=521 Len=1382 [TCP segment of a reassembled PDU]"
"262","0.022947","176.235.75.83","172.16.7.65","TCP","1436","443  >  54052 [ACK] Seq=327614 Ack=3867 Win=521 Len=1382 [TCP segment of a reassembled PDU]"
"263","0.022947","176.235.75.83","172.16.7.65","TLSv1.2","1436","Application Data"
"264","0.022947","176.235.75.83","172.16.7.65","TCP","1436","443  >  54052 [ACK] Seq=330378 Ack=3867 Win=521 Len=1382 [TCP segment of a reassembled PDU]"
"265","0.022947","176.235.75.83","172.16.7.65","TCP","1436","443  >  54052 [ACK] Seq=331760 Ack=3867 Win=521 Len=1382 [TCP segment of a reassembled PDU]"
"266","0.022947","176.235.75.83","172.16.7.65","TCP","1436","443  >  54052 [ACK] Seq=333142 Ack=3867 Win=521 Len=1382 [TCP segment of a reassembled PDU]"
"267","0.022947","176.235.75.83","172.16.7.65","TCP","1436","443  >  54052 [ACK] Seq=334524 Ack=3867 Win=521 Len=1382 [TCP segment of a reassembled PDU]"
"268","0.022947","176.235.75.83","172.16.7.65","TCP","1436","443  >  54052 [ACK] Seq=335906 Ack=3867 Win=521 Len=1382 [TCP segment of a reassembled PDU]"
"269","0.022947","176.235.75.83","172.16.7.65","TCP","1436","443  >  54052 [ACK] Seq=337288 Ack=3867 Win=521 Len=1382 [TCP segment of a reassembled PDU]"
"270","0.022947","176.235.75.83","172.16.7.65","TCP","1436","443  >  54052 [ACK] Seq=338670 Ack=3867 Win=521 Len=1382 [TCP segment of a reassembled PDU]"
"271","0.022947","176.235.75.83","172.16.7.65","TCP","1436","443  >  54052 [ACK] Seq=340052 Ack=3867 Win=521 Len=1382 [TCP segment of a reassembled PDU]"
"272","0.022947","176.235.75.83","172.16.7.65","TCP","1436","443  >  54052 [ACK] Seq=341434 Ack=3867 Win=521 Len=1382 [TCP segment of a reassembled PDU]"
"273","0.022947","176.235.75.83","172.16.7.65","TCP","1436","443  >  54052 [ACK] Seq=342816 Ack=3867 Win=521 Len=1382 [TCP segment of a reassembled PDU]"
"274","0.022947","176.235.75.83","172.16.7.65","TCP","1436","443  >  54052 [ACK] Seq=344198 Ack=3867 Win=521 Len=1382 [TCP segment of a reassembled PDU]"
"275","0.022947","176.235.75.83","172.16.7.65","TLSv1.2","1436","Application Data"
"276","0.022947","176.235.75.83","172.16.7.65","TCP","1436","443  >  54052 [ACK] Seq=346962 Ack=3867 Win=521 Len=1382 [TCP segment of a reassembled PDU]"
"277","0.022947","176.235.75.83","172.16.7.65","TCP","1436","443  >  54052 [PSH, ACK] Seq=348344 Ack=3867 Win=521 Len=1382 [TCP segment of a reassembled PDU]"
"278","0.022947","176.235.75.83","172.16.7.65","TCP","1436","443  >  54052 [ACK] Seq=349726 Ack=3867 Win=521 Len=1382 [TCP segment of a reassembled PDU]"
"279","0.022947","176.235.75.83","172.16.7.65","TCP","1436","443  >  54052 [ACK] Seq=351108 Ack=3867 Win=521 Len=1382 [TCP segment of a reassembled PDU]"
"281","0.024989","176.235.75.83","172.16.7.65","TCP","1436","443  >  54052 [ACK] Seq=352490 Ack=3867 Win=521 Len=1382 [TCP segment of a reassembled PDU]"
"282","0.024989","176.235.75.83","172.16.7.65","TCP","1436","443  >  54052 [ACK] Seq=353872 Ack=3867 Win=521 Len=1382 [TCP segment of a reassembled PDU]"
"283","0.024989","176.235.75.83","172.16.7.65","TCP","1436","443  >  54052 [ACK] Seq=355254 Ack=3867 Win=521 Len=1382 [TCP segment of a reassembled PDU]"
"284","0.024989","176.235.75.83","172.16.7.65","TCP","1436","443  >  54052 [ACK] Seq=356636 Ack=3867 Win=521 Len=1382 [TCP segment of a reassembled PDU]"
"285","0.024989","176.235.75.83","172.16.7.65","TCP","1436","443  >  54052 [ACK] Seq=358018 Ack=3867 Win=521 Len=1382 [TCP segment of a reassembled PDU]"
"286","0.024989","176.235.75.83","172.16.7.65","TCP","1436","443  >  54052 [ACK] Seq=359400 Ack=3867 Win=521 Len=1382 [TCP segment of a reassembled PDU]"
"287","0.024989","176.235.75.83","172.16.7.65","TCP","1436","443  >  54052 [ACK] Seq=360782 Ack=3867 Win=521 Len=1382 [TCP segment of a reassembled PDU]"
"288","0.024989","176.235.75.83","172.16.7.65","TLSv1.2","1436","Application Data"
"289","0.024989","176.235.75.83","172.16.7.65","TCP","1436","443  >  54052 [ACK] Seq=363546 Ack=3867 Win=521 Len=1382 [TCP segment of a reassembled PDU]"
